INIT DATA
CREATE TABLE UPDATE_TABLE_2(ID INT, T_NAME CHAR(4), COL1 INT, COL2 INT);
SUCCESS
CREATE TABLE UPDATE_TABLE_3(ID INT, T_NAME CHAR(4), COL1 INT, COL2 INT);
SUCCESS
INSERT INTO UPDATE_TABLE_2 VALUES (1,'N1',1,1);
SUCCESS
INSERT INTO UPDATE_TABLE_2 VALUES (2,'N2',1,1);
SUCCESS
INSERT INTO UPDATE_TABLE_2 VALUES (3,'N3',3,1);
SUCCESS
INSERT INTO UPDATE_TABLE_2 VALUES (4,'N3',4,2);
SUCCESS
INSERT INTO UPDATE_TABLE_2 VALUES (5,'N3',5,3);
SUCCESS
INSERT INTO UPDATE_TABLE_3 VALUES (1,'N1',1,1);
SUCCESS
INSERT INTO UPDATE_TABLE_3 VALUES (2,'N2',2,2);
SUCCESS
INSERT INTO UPDATE_TABLE_3 VALUES (3,'N3',3,3);
SUCCESS
INSERT INTO UPDATE_TABLE_3 VALUES (4,'N4',4,4);
SUCCESS
INSERT INTO UPDATE_TABLE_3 VALUES (5,'N5',5,5);
SUCCESS
INSERT INTO UPDATE_TABLE_3 VALUES (6,'N6',6,6);
SUCCESS
INSERT INTO UPDATE_TABLE_3 VALUES (6,'N6',6,6);
SUCCESS

1. UPDATE-SELECT
UPDATE UPDATE_TABLE_2 SET T_NAME='N01', COL2=2 WHERE ID=1;
SUCCESS
UPDATE UPDATE_TABLE_2 SET COL1=2, COL2=(SELECT UPDATE_TABLE_3.COL2 FROM UPDATE_TABLE_3 WHERE UPDATE_TABLE_3.ID=1) WHERE ID=1;
SUCCESS
SELECT * FROM UPDATE_TABLE_2;
1 | N01 | 2 | 1
2 | N2 | 1 | 1
3 | N3 | 3 | 1
4 | N3 | 4 | 2
5 | N3 | 5 | 3
ID | T_NAME | COL1 | COL2

2. UPDATE-SELECT ROWS
UPDATE UPDATE_TABLE_2 SET COL1=(SELECT UPDATE_TABLE_3.COL2 FROM UPDATE_TABLE_3) WHERE ID=1;
FAILURE
UPDATE UPDATE_TABLE_2 SET COL1=(SELECT UPDATE_TABLE_3.COL2 FROM UPDATE_TABLE_3 WHERE UPDATE_TABLE_3.ID>1) WHERE ID=1;
FAILURE
UPDATE UPDATE_TABLE_2 SET T_NAME=(SELECT UPDATE_TABLE_3.COL2 FROM UPDATE_TABLE_3 WHERE UPDATE_TABLE_3.ID<1) WHERE ID=1;
SUCCESS
SELECT * FROM UPDATE_TABLE_2;
1 | NULL | 2 | 1
2 | N2 | 1 | 1
3 | N3 | 3 | 1
4 | N3 | 4 | 2
5 | N3 | 5 | 3
ID | T_NAME | COL1 | COL2

3. UPDATE ROWS-SELECT ROWS
UPDATE UPDATE_TABLE_3 SET COL1=(SELECT COL2 FROM UPDATE_TABLE_2);
FAILURE
SELECT * FROM UPDATE_TABLE_3;
1 | N1 | 1 | 1
2 | N2 | 2 | 2
3 | N3 | 3 | 3
4 | N4 | 4 | 4
5 | N5 | 5 | 5
6 | N6 | 6 | 6
6 | N6 | 6 | 6
ID | T_NAME | COL1 | COL2

3. UPDATE ROWS-SELECT COLS AND ROWS
UPDATE UPDATE_TABLE_3 SET COL1=(SELECT COL1, COL2 FROM UPDATE_TABLE_2);
FAILURE
SELECT * FROM UPDATE_TABLE_3;
1 | N1 | 1 | 1
2 | N2 | 2 | 2
3 | N3 | 3 | 3
4 | N4 | 4 | 4
5 | N5 | 5 | 5
6 | N6 | 6 | 6
6 | N6 | 6 | 6
ID | T_NAME | COL1 | COL2

4. CHECK TYPECAST
UPDATE UPDATE_TABLE_3 SET T_NAME=813,COL1=547.82 WHERE ID=2;
SUCCESS
UPDATE UPDATE_TABLE_3 SET T_NAME=(SELECT UPDATE_TABLE_2.COL1 FROM UPDATE_TABLE_2 WHERE UPDATE_TABLE_2.ID=3), COL2=(SELECT MIN(UPDATE_TABLE_3.COL2) FROM UPDATE_TABLE_3 WHERE UPDATE_TABLE_3.ID=1) WHERE ID=5;
SUCCESS
SELECT * FROM UPDATE_TABLE_3;
1 | N1 | 1 | 1
2 | 813 | 548 | 2
3 | N3 | 3 | 3
4 | N4 | 4 | 4
5 | 3 | 5 | 1
6 | N6 | 6 | 6
6 | N6 | 6 | 6
ID | T_NAME | COL1 | COL2

5. SUBQUERY RETURN NULL
UPDATE UPDATE_TABLE_3 SET COL1=2, COL2=(SELECT UPDATE_TABLE_2.COL2 FROM UPDATE_TABLE_2 WHERE UPDATE_TABLE_2.ID=999) WHERE ID=4;
SUCCESS
UPDATE UPDATE_TABLE_3 SET COL1=2, COL2=(SELECT UPDATE_TABLE_2.COL2 FROM UPDATE_TABLE_2 WHERE UPDATE_TABLE_2.ID=999) WHERE ID=666;
SUCCESS
SELECT * FROM UPDATE_TABLE_3;
1 | N1 | 1 | 1
2 | 813 | 548 | 2
3 | N3 | 3 | 3
4 | N4 | 2 | NULL
5 | 3 | 5 | 1
6 | N6 | 6 | 6
6 | N6 | 6 | 6
ID | T_NAME | COL1 | COL2

6. SUBQUERY RETURN MULTIPLE ROWS
UPDATE UPDATE_TABLE_2 SET T_NAME=(SELECT UPDATE_TABLE_3.T_NAME FROM UPDATE_TABLE_3 WHERE UPDATE_TABLE_3.ID=6) WHERE COL1=5 AND COL2=3;
FAILURE
UPDATE UPDATE_TABLE_2 SET T_NAME=(SELECT UPDATE_TABLE_3.T_NAME FROM UPDATE_TABLE_3 WHERE UPDATE_TABLE_3.ID=6) WHERE COL1=5 AND COL2=6;
SUCCESS
SELECT * FROM UPDATE_TABLE_2;
1 | NULL | 2 | 1
2 | N2 | 1 | 1
3 | N3 | 3 | 1
4 | N3 | 4 | 2
5 | N3 | 5 | 3
ID | T_NAME | COL1 | COL2
