INITIALIZATION
CREATE TABLE UNIQUE_TABLE(ID INT, COL1 INT, COL2 INT);
SUCCESS
CREATE TABLE UNIQUE_TABLE2(ID1 INT, ID2 INT, COL1 INT, COL2 INT);
SUCCESS
INSERT INTO UNIQUE_TABLE VALUES (1,1,1);
SUCCESS
INSERT INTO UNIQUE_TABLE2 VALUES (1,1,1,1);
SUCCESS

1. UNIQUE TEST
CREATE UNIQUE INDEX INDEX_ID ON UNIQUE_TABLE(ID);
SUCCESS
INSERT INTO UNIQUE_TABLE VALUES (2,1,1);
SUCCESS
CREATE UNIQUE INDEX INDEX_ID ON UNIQUE_TABLE(ID);
FAILURE
INSERT INTO UNIQUE_TABLE VALUES (3,2,1);
SUCCESS
INSERT INTO UNIQUE_TABLE VALUES (1,2,1);
FAILURE

CREATE UNIQUE INDEX INDEX_ID ON UNIQUE_TABLE2(ID1, ID2);
SUCCESS
INSERT INTO UNIQUE_TABLE2 VALUES (1,1,2,1);
FAILURE
INSERT INTO UNIQUE_TABLE2 VALUES (1,2,1,1);
SUCCESS
INSERT INTO UNIQUE_TABLE2 VALUES (1,2,2,1);
FAILURE
INSERT INTO UNIQUE_TABLE2 VALUES (1,3,4,2);
SUCCESS
INSERT INTO UNIQUE_TABLE2 VALUES (2,1,1,1);
SUCCESS

2. SELECT
SELECT * FROM UNIQUE_TABLE;
1 | 1 | 1
2 | 1 | 1
3 | 2 | 1
ID | COL1 | COL2
SELECT * FROM UNIQUE_TABLE2;
1 | 1 | 1 | 1
1 | 2 | 1 | 1
1 | 3 | 4 | 2
2 | 1 | 1 | 1
ID1 | ID2 | COL1 | COL2

3. DROP INDEX AND RESTORE
DROP INDEX INDEX_ID ON UNIQUE_TABLE;
SUCCESS
INSERT INTO UNIQUE_TABLE VALUES (1,2,1);
SUCCESS
CREATE UNIQUE INDEX INDEX_ID ON UNIQUE_TABLE(ID);
SUCCESS

4. UPDATE WITH UNIQUE INDEX
CREATE TABLE T2(X INT, Y CHAR(10));
SUCCESS
INSERT INTO T2 VALUES(1,'AAAA');
SUCCESS
INSERT INTO T2 VALUES (4,'LINN');
SUCCESS
INSERT INTO T2 VALUES(3,'CCCC');
SUCCESS
CREATE UNIQUE INDEX INDEX_T2 ON T2(Y);
SUCCESS
UPDATE T2 SET Y='CCCC' WHERE Y='AAAA';
FAILURE
SELECT * FROM T2;
1 | aaaa
4 | Linn
3 | cccc
X | Y
