INITIALIZATION
CREATE TABLE TYPECAST_TABLE_1(ID INT, NAME CHAR(20), AGE FLOAT);
SUCCESS

1. INSERT ROWS
INSERT INTO TYPECAST_TABLE_1 VALUES(666, 666, 666);
SUCCESS
INSERT INTO TYPECAST_TABLE_1 VALUES('1', '1', '1');
SUCCESS
INSERT INTO TYPECAST_TABLE_1 VALUES('ABC', 'ABC', 'ABC');
SUCCESS
INSERT INTO TYPECAST_TABLE_1 VALUES('0.5', '0.5', '0.5');
SUCCESS
INSERT INTO TYPECAST_TABLE_1 VALUES('3ABC', 'ABCD', '3.14ADC');
SUCCESS
INSERT INTO TYPECAST_TABLE_1 VALUES('4ABC', 'DCBA', 'G3.14ADC');
SUCCESS
INSERT INTO TYPECAST_TABLE_1 VALUES(1.5, 1.5, 1.5);
SUCCESS
INSERT INTO TYPECAST_TABLE_1 VALUES(-1.5, -1.5, -1.5);
SUCCESS
SELECT * FROM TYPECAST_TABLE_1;
-2 | 1.5 | -1.5
0 | 0.5 | 0.5
0 | ABC | 0
1 | 1 | 1
2 | 1.5 | 1.5
3 | ABCD | 3.14
4 | DCBA | 0
666 | 666 | 666
ID | NAME | AGE

2. QUERY ROWS
SELECT * FROM TYPECAST_TABLE_1 WHERE ID > 0.5;
1 | 1 | 1
2 | 1.5 | 1.5
3 | ABCD | 3.14
4 | DCBA | 0
666 | 666 | 666
ID | NAME | AGE
SELECT * FROM TYPECAST_TABLE_1 WHERE ID > '0.1';
1 | 1 | 1
2 | 1.5 | 1.5
3 | ABCD | 3.14
4 | DCBA | 0
666 | 666 | 666
ID | NAME | AGE
SELECT * FROM TYPECAST_TABLE_1 WHERE ID > '1ADC';
2 | 1.5 | 1.5
3 | ABCD | 3.14
4 | DCBA | 0
666 | 666 | 666
ID | NAME | AGE
SELECT * FROM TYPECAST_TABLE_1 WHERE ID < '1.5ADC';
-2 | 1.5 | -1.5
0 | 0.5 | 0.5
0 | ABC | 0
1 | 1 | 1
ID | NAME | AGE
SELECT * FROM TYPECAST_TABLE_1 WHERE NAME >= 1;
-2 | 1.5 | -1.5
1 | 1 | 1
2 | 1.5 | 1.5
666 | 666 | 666
ID | NAME | AGE
SELECT * FROM TYPECAST_TABLE_1 WHERE NAME > 1.3;
-2 | 1.5 | -1.5
2 | 1.5 | 1.5
666 | 666 | 666
ID | NAME | AGE
SELECT * FROM TYPECAST_TABLE_1 WHERE NAME > '1ADC';
0 | ABC | 0
3 | ABCD | 3.14
4 | DCBA | 0
666 | 666 | 666
ID | NAME | AGE
SELECT * FROM TYPECAST_TABLE_1 WHERE AGE > 1;
2 | 1.5 | 1.5
3 | ABCD | 3.14
666 | 666 | 666
ID | NAME | AGE
SELECT * FROM TYPECAST_TABLE_1 WHERE AGE > 1.2;
2 | 1.5 | 1.5
3 | ABCD | 3.14
666 | 666 | 666
ID | NAME | AGE
SELECT * FROM TYPECAST_TABLE_1 WHERE AGE > 2.5;
3 | ABCD | 3.14
666 | 666 | 666
ID | NAME | AGE
SELECT * FROM TYPECAST_TABLE_1 WHERE AGE > '1ADC';
2 | 1.5 | 1.5
3 | ABCD | 3.14
666 | 666 | 666
ID | NAME | AGE

3. UPDATE ROWS
UPDATE TYPECAST_TABLE_1 SET ID = 6, NAME = 6, AGE = 6 WHERE ID = 1;
SUCCESS
UPDATE TYPECAST_TABLE_1 SET ID = '66', NAME = '66', AGE = '66' WHERE ID = 2;
SUCCESS
UPDATE TYPECAST_TABLE_1 SET ID = 'JF', NAME = 'JF', AGE = 'JF' WHERE ID = -2;
SUCCESS
UPDATE TYPECAST_TABLE_1 SET ID = '0.5', NAME = '0.5', AGE = '0.5' WHERE ID = 0;
SUCCESS
UPDATE TYPECAST_TABLE_1 SET ID = '3ABC', NAME = 'ABCD', AGE = '3.14ADC' WHERE ID = 4;
SUCCESS
UPDATE TYPECAST_TABLE_1 SET ID = '4ABC', NAME = 'DCBA', AGE = 'G3.14ADC' WHERE ID = 4;
SUCCESS
UPDATE TYPECAST_TABLE_1 SET ID = 6.6, NAME = 6.6, AGE = '6.6' WHERE ID = 3;
SUCCESS
UPDATE TYPECAST_TABLE_1 SET ID = -8.8, NAME = -8.8, AGE = '-8.8' WHERE ID = 666;
SUCCESS
SELECT * FROM TYPECAST_TABLE_1;
-9 | 8.8 | -8.8
0 | 0.5 | 0.5
0 | 0.5 | 0.5
0 | 0.5 | 0.5
6 | 6 | 6
66 | 66 | 66
7 | 6.6 | 6.6
7 | 6.6 | 6.6
ID | NAME | AGE

4. QUERY ROWS AGAIN
SELECT * FROM TYPECAST_TABLE_1 WHERE '1A' = 2;
ID | NAME | AGE
SELECT * FROM TYPECAST_TABLE_1 WHERE '1.5A' = 2;
ID | NAME | AGE
SELECT * FROM TYPECAST_TABLE_1 WHERE '1.5A' = 2.0;
ID | NAME | AGE
SELECT * FROM TYPECAST_TABLE_1 WHERE '2A' = 2.0;
-9 | 8.8 | -8.8
0 | 0.5 | 0.5
0 | 0.5 | 0.5
0 | 0.5 | 0.5
6 | 6 | 6
66 | 66 | 66
7 | 6.6 | 6.6
7 | 6.6 | 6.6
ID | NAME | AGE
SELECT * FROM TYPECAST_TABLE_1 WHERE '2.0-A' = 2.0;
-9 | 8.8 | -8.8
0 | 0.5 | 0.5
0 | 0.5 | 0.5
0 | 0.5 | 0.5
6 | 6 | 6
66 | 66 | 66
7 | 6.6 | 6.6
7 | 6.6 | 6.6
ID | NAME | AGE

5. TYPE PROMOTION
SELECT * FROM TYPECAST_TABLE_1 WHERE AGE >= 7.0;
66 | 66 | 66
ID | NAME | AGE
SELECT * FROM TYPECAST_TABLE_1 WHERE AGE >= 7;
66 | 66 | 66
ID | NAME | AGE
SELECT * FROM TYPECAST_TABLE_1 WHERE ID >= 6;
6 | 6 | 6
66 | 66 | 66
7 | 6.6 | 6.6
7 | 6.6 | 6.6
ID | NAME | AGE
SELECT * FROM TYPECAST_TABLE_1 WHERE ID >= 6.25;
66 | 66 | 66
7 | 6.6 | 6.6
7 | 6.6 | 6.6
ID | NAME | AGE
